CN-115766216-A,"Identity retrieving method and device based on block chain, medium and electronic equipment ",中国电信股份有限公司,"张祎, 赵飞飞, 邹一心, 沈骁",2022-11-14,2022-11-14,2023-03-07,,https://patents.google.com/patent/CN115766216A/en,https://patentimages.storage.googleapis.com/ae/64/dd/786a73e4abea1a/HDA0003942094890000011.png
CN-113516020-A,Age change related identity verification method and system ,"郑州大学, 河南郑大道可信息技术有限公司","周兵, 聂茜茜, 王俊淇, 宋子龙, 魏雅婷, 李�浩, 李凯江, 谷田鑫, 李世华, 王培森",2021-04-23,2021-04-23,2021-10-19,,https://patents.google.com/patent/CN113516020A/en,https://patentimages.storage.googleapis.com/ff/d1/41/21d61f214bbcbd/210423144128.png
CN-116232590-A,"Digital asset processing method, device and system based on block chain ",中国工商银行股份有限公司,"岑健明, 裴磊, 黄剑, 陈浩坚",2023-03-31,2023-03-31,2023-06-06,,https://patents.google.com/patent/CN116232590A/en,https://patentimages.storage.googleapis.com/3a/da/d7/da005224916dc8/HDA0004158869490000011.png
US-2023177487-A1,Digital wallet as a relying party in a decentralized network ,"Microsoft Technology Licensing, Llc","Brandon MURDOCH, Ankur Patel, Frank Michael Chiachiere",2020-04-28,2021-04-26,2023-06-08,,https://patents.google.com/patent/US20230177487A1/en,https://patentimages.storage.googleapis.com/27/51/14/bee5c8f8dc3f10/US20230177487A1-20230608-D00000.png
WO-2023104690-A1,Asynchronous code execution for enhanced performance and security measures protecting digital security devices ,Thales Dis France Sas,"Emmanuel LEPAVEC, Xavier MINETTE DE SAINT-MARTIN, Dominique Bouveron",2021-12-07,2022-12-05,2023-06-15,,https://patents.google.com/patent/WO2023104690A1/en,
CN-112565294-A,Identity authentication method based on block chain electronic signature ,杭州天谷信息科技有限公司,"李程, 金宏洲, 程亮",2020-12-23,2020-12-23,2021-03-26,,https://patents.google.com/patent/CN112565294A/en,https://patentimages.storage.googleapis.com/21/94/27/9ca1ee8f23c2b4/HDA0002855336220000011.png
US-2023237190-A1,Decentralized identity metaverse database system ,"Salesforce.Com, Inc.",Prithvi Krishnan Padmanabhan,2022-01-25,2022-01-25,2023-07-27,,https://patents.google.com/patent/US20230237190A1/en,https://patentimages.storage.googleapis.com/5d/2c/b4/a5856ccb0dfa2b/US20230237190A1-20230727-D00000.png
CN-114666052-A,Identity authentication system and method ,御天守(江苏)信息科技有限公司,"米拉德·塔利比-阿瓦努埃, 张静",2022-04-12,2022-04-12,2022-06-24,,https://patents.google.com/patent/CN114666052A/en,https://patentimages.storage.googleapis.com/61/82/c5/878e8b2e98a7e9/HDA0003591908340000011.png
WO-2022251894-A1,Systems and methods for secure digital file sharing and authenticating ,Medikey Australia Pty Ltd,"Paul Zietsman, Michael Joseph",2021-06-01,2021-06-01,2022-12-08,,https://patents.google.com/patent/WO2022251894A1/en,
CN-212208331-U,Intelligent glasses hydraulic operation and maintenance digital system ,"国家电网有限公司, 国网新源控股有限公司, 华东琅琊山抽水蓄能有限责任公司, 北京易用视点科技有限公司","马保东, 刘福, 王培杰, 闵从军, 周瑛, 万昔超, 路庆瑞, 刘生智, 魏生平, 雷晓华, 方均, 李军, 李春龙, 张鑫",2020-05-26,2020-05-26,2020-12-22,2020-12-22,https://patents.google.com/patent/CN212208331U/en,https://patentimages.storage.googleapis.com/b7/c3/7a/0b37fbd0b1a051/200526102111.png
CN-114900354-A,Distributed identity authentication and management method and system for energy data ,"国网山东省电力公司德州供电公司, 山东鲁软数字科技有限公司","刘朝章, 唐琳, 张玉豹, 邢宏伟, 张建辉, 李恩堂, 薛念明, 徐崇豪, 李向阳",2022-05-05,2022-05-05,2022-08-12,,https://patents.google.com/patent/CN114900354A/en,https://patentimages.storage.googleapis.com/d5/b1/97/628f7a0fc959ba/HDA0003627328140000011.png
CN-114816338-A,Chinese character digital calculation method ,曹鸿,曹鸿,2022-05-20,2022-05-20,2022-07-29,,https://patents.google.com/patent/CN114816338A/en,https://patentimages.storage.googleapis.com/00/4e/aa/9c459018d5a3ba/HDA0003654725250000011.png
CN-115052016-A,Customizable digital firework collection generation system based on block chain technology ,上海万向区块链股份公司,任重远,2022-06-08,2022-06-08,2022-09-13,,https://patents.google.com/patent/CN115052016A/en,https://patentimages.storage.googleapis.com/31/71/1d/38fd95e0d1de07/HDA0003683735890000011.png
CN-115333751-A,Decentralized digital certificate management method and system ,中铱数字科技有限公司,"胡勇, 李钰, 贾康, 张迪",2022-08-10,2022-08-10,2022-11-11,,https://patents.google.com/patent/CN115333751A/en,https://patentimages.storage.googleapis.com/86/e2/d4/6a4696505948eb/HDA0003790621930000011.png
CN-115632795-A,Autonomous identity management method based on block chain ,"西安热工研究院有限公司, 华能集团技术创新中心有限公司","李凯, 杨东, 王文庆, 崔逸群, 吕珍珍, 邓楠轶, 毕玉冰, 刘超飞, 董夏昕, 刘鹏举, 刘迪, 朱召鹏, 王艺杰, 介银娟, 崔鑫",2022-10-20,2022-10-20,2023-01-20,,https://patents.google.com/patent/CN115632795A/en,https://patentimages.storage.googleapis.com/09/c6/0e/b277755ef9760f/HDA0003900790680000011.png
WO-2023121711-A1,Computer-implemented digital communication using cryptography ,"Citizens Reserve, Inc.","Lucas HENNING, Addison David MCKENZIE, Yonathan LAPCHIK",2021-12-22,2022-06-17,2023-06-29,,https://patents.google.com/patent/WO2023121711A1/en,
CN-116074126-A,Identity management method and device based on intelligent contract ,天聚地合(苏州)科技股份有限公司,"邢炬, 左磊",2023-03-31,2023-03-31,2023-05-05,,https://patents.google.com/patent/CN116074126A/en,https://patentimages.storage.googleapis.com/eb/ad/4f/1f8550d1d96df8/FT_2.png
CN-115766007-A,System for realizing one-factory multi-place unified identity authentication ,中国直升机设计研究所,董航,2022-11-17,2022-11-17,2023-03-07,,https://patents.google.com/patent/CN115766007A/en,https://patentimages.storage.googleapis.com/fd/00/46/f16b9d4f828dc1/HDA0003948254870000011.png
CN-216670726-U,Management device for network operation and maintenance to identify identity ,长春市铂众信息科技有限公司,赵冬丽,2022-01-14,2022-01-14,2022-06-03,2022-06-03,https://patents.google.com/patent/CN216670726U/en,https://patentimages.storage.googleapis.com/0e/6f/d8/3e10c0fcf11909/HDA0003470443190000011.png
CN-214670610-U,Handheld intelligent identity authentication equipment ,深圳市华视奥科电子有限公司,"高云飞, 杨金锋",2020-11-09,2020-11-09,2021-11-09,2021-11-09,https://patents.google.com/patent/CN214670610U/en,https://patentimages.storage.googleapis.com/a2/b2/05/fc715d8c37a2fa/HDA0002767426700000011.png
CN-116506233-A,Identity authentication model based on distributed group cooperation ,积至网络(北京)有限公司,"李钊, 杨佳庚, 尹姜谊, 顾凡",2023-06-29,2023-06-29,2023-07-28,,https://patents.google.com/patent/CN116506233A/en,
FR-3128344-A1,Method for the immediate provision of a non-fungible token from a digital file of a mobile terminal connected to a blockchain service ,Artrade.App,Paul WEIBEL,2021-10-18,2021-10-18,2023-04-21,,https://patents.google.com/patent/FR3128344A1/en,
US-2023162519-A1,Memory-efficient feature descriptors for localization and classification of identity documents ,Smart Engines Service LLC,"Daniil Pavlovich MATALOV, Elena Evgenyevna LIMONOVA, Natalya Sergeevna SKORYUKINA, Vladimir Viktorovich ARLAZAROV",2021-11-19,2022-11-11,2023-05-25,,https://patents.google.com/patent/US20230162519A1/en,https://patentimages.storage.googleapis.com/ca/95/c7/8bf95bd38be8ad/US20230162519A1-20230525-D00000.png
CN-116452119-A,Digital supervision method and device for grain inventory ,浪潮云洲(山东)工业互联网有限公司,"周广科, 马龙, 李文博, 张霖, 肖雪, 商广勇",2023-06-07,2023-06-07,2023-07-18,,https://patents.google.com/patent/CN116452119A/en,
CN-114297607-A,Identity authentication method and equipment ,华为技术有限公司,"王东晖, 陈晶, 詹泽怡",2020-09-22,2020-09-22,2022-04-08,,https://patents.google.com/patent/CN114297607A/en,https://patentimages.storage.googleapis.com/33/fe/8b/38cc440a695110/HDA0002693891770000011.png
CN-116566623-A,"Method, system and electronic equipment for acquiring anonymous digital certificate ",北京天润基业科技发展股份有限公司,"俞海清, 胡益榕",2023-07-05,2023-07-05,2023-08-08,,https://patents.google.com/patent/CN116566623A/en,
CN-116418575-A,Vehicle identity authentication method based on blockchain intelligent contract ,宁波大学,"邱倬亮, 谢志军, 尹杨, 江先亮, 奉志强",2023-03-31,2023-03-31,2023-07-11,,https://patents.google.com/patent/CN116418575A/en,
US-2023206219-A1,"Identification token, systems and methods for identification and identity verification. ",Duy Khuong,Duy Khuong,2021-12-29,2022-12-29,2023-06-29,,https://patents.google.com/patent/US20230206219A1/en,https://patentimages.storage.googleapis.com/ec/36/a9/1168e60076395b/US20230206219A1-20230629-D00000.png
CN-113835968-A,"Application server interface management method, device and medium suitable for digital security chain ",浪潮卓数大数据产业发展有限公司,"王语伶, 董晨晨, 张艳雪, 李照川, 赵海兴, 周晓英",2021-09-29,2021-09-29,2021-12-24,,https://patents.google.com/patent/CN113835968A/en,https://patentimages.storage.googleapis.com/04/3b/b6/a818811d330555/HDA0003286785440000011.png
CN-113746640-A,"Digital certificate using method and device, computer equipment and storage medium ",网易（杭州）网络有限公司,"曹崇瑞, 胡志鹏, 王挺, 顾费勇, 李刚锐",2021-09-26,2021-09-26,2021-12-03,,https://patents.google.com/patent/CN113746640A/en,https://patentimages.storage.googleapis.com/e6/3e/e8/513633d2784f5d/HDA0003280220870000011.png
US-2022141091-A1,Digital ownership escrow for network-configurable devices ,"Microsoft Technology Licensing, Llc","Hanumantha Rao KOMMALAPATI, Nicole Elaine BERDY, Samuel John George, Cameron William SKINNER",2020-10-30,2020-10-30,2022-05-05,,https://patents.google.com/patent/US20220141091A1/en,https://patentimages.storage.googleapis.com/16/6d/5d/7e58414d70bec5/US20220141091A1-20220505-D00000.png
CN-116312118-A,Meta hospital system based on augmented reality digital twinning ,首都医科大学,"吴瑛, 王慧莹, 吴芳琴, 杨芳宇, 丁舒, 陈婧楠, 刘铭萱, 王秋实, 方彤",2023-03-15,2023-03-15,2023-06-23,,https://patents.google.com/patent/CN116312118A/en,https://patentimages.storage.googleapis.com/68/24/53/a69a2162d0689e/HDA0004133574500000011.png
WO-2022173930-A1,Privacy preserving identity data exchange based on hybrid encryption ,Visa International Service Association,"Sunpreet ARORA, Saikrishna BADRINARAYANAN, Srinivasan Raghuraman, Kim Wagner, Gaven WATSON",2021-02-12,2022-02-10,2022-08-18,,https://patents.google.com/patent/WO2022173930A1/en,
KR-20230020735-A,Decentralized identity key recovery system and method based on smart contract wallet ,주식회사 아이오트러스트,"백상수, 박준후",2021-08-04,2021-08-04,2023-02-13,,https://patents.google.com/patent/KR20230020735A/en,https://patentimages.storage.googleapis.com/72/c3/51/efd20e8ac5b19a/pat00007.png
CN-112862481-A,Block chain digital asset key management method and system based on SIM card ,联通雄安产业互联网有限公司,"白鑫, 路晓, 唐伟东",2021-01-25,2021-01-25,2021-05-28,,https://patents.google.com/patent/CN112862481A/en,https://patentimages.storage.googleapis.com/db/d8/77/abaf7c3baa2846/HDA0002915038580000011.png
CN-113051537-B,"Identity verification method and device, electronic equipment and computer readable medium ",深圳市声扬科技有限公司,"李亚桐, 陈东鹏",2021-03-23,2021-03-23,2023-02-10,2023-02-10,https://patents.google.com/patent/CN113051537B/en,https://patentimages.storage.googleapis.com/2d/41/1c/171858c15d6b82/HDA0002989444310000011.png
EP-4060541-A1,Securely sharing digital assets in a peer-to-peer network ,Igor Sokrut,Igor Sokrut,2021-03-14,2021-03-14,2022-09-21,,https://patents.google.com/patent/EP4060541A1/en,https://patentimages.storage.googleapis.com/fb/a2/9e/c80d8d9faa4c72/imgf0001.png
CN-112953959-A,Authentication method and device ,中国民航信息网络股份有限公司,"王晓亮, 刘宇, 王晶, 李晴, 姜孟旸",2021-03-10,2021-03-10,2021-06-11,,https://patents.google.com/patent/CN112953959A/en,https://patentimages.storage.googleapis.com/78/d5/31/c128e2bd081fe2/HDA0002969370080000011.png
CN-114124422-A,Key management method and device ,北京书生网络技术有限公司,王东临,2020-08-31,2020-08-31,2022-03-01,,https://patents.google.com/patent/CN114124422A/en,https://patentimages.storage.googleapis.com/5f/4e/db/8ef6a30c89d92b/HDA0002659522010000011.png
US-11516666-B1,"Access controlling network architectures utilizing cellular signaled access control to restricted services with expected keys in accordance with novel communications protocols, and methods for use thereof ",Starkeys Llc,Ari Kahn,2022-05-22,2022-05-22,2022-11-29,2022-11-29,https://patents.google.com/patent/US11516666B1/en,https://patentimages.storage.googleapis.com/25/6b/2f/af7502293a9dc6/US11516666-20221129-D00000.png
CN-116485072-A,Carbon metering method ,北京金骏捷电子科技有限责任公司,刘建华,2023-04-14,2023-04-14,2023-07-25,,https://patents.google.com/patent/CN116485072A/en,
CN-115314513-A,Trust twinning method based on block chain and related equipment ,北京邮电大学,"邹仕洪, 叶成杰, 徐国爱, 徐国胜",2022-06-16,2022-06-16,2022-11-08,,https://patents.google.com/patent/CN115314513A/en,https://patentimages.storage.googleapis.com/87/4f/9d/a9f6cef4a32af7/HDA0003698357350000011.png
CN-216383584-U,Wisdom gas cylinder fills dress control system that traces to source ,重庆延伸科技开发有限公司,徐延生,2021-03-15,2021-03-15,2022-04-26,2022-04-26,https://patents.google.com/patent/CN216383584U/en,https://patentimages.storage.googleapis.com/f3/49/53/af30190890953f/HDA0002977187450000011.png
WO-2023099049-A1,"Method for responding to published content, method for assessing a response to published content, computer programs, non-transitory machine-readable media, and apparatuses therefor ","Sony Group Corporation, Sony Europe B.V",Claesen RIK,2021-12-01,2022-08-18,2023-06-08,,https://patents.google.com/patent/WO2023099049A1/en,
CN-112861187-A,Data processing method and device based on block chain ,支付宝(杭州)信息技术有限公司,周晓云,2021-01-28,2021-01-28,2021-05-28,,https://patents.google.com/patent/CN112861187A/en,https://patentimages.storage.googleapis.com/15/63/f7/94e8cd8b14e4df/HDA0002922182850000011.png
CN-114079921-A,"Generation method of session key, anchor point function network element and system ",中国电信股份有限公司,"郭茂文, 张�荣, 黎艳, 卢燕青, 郭建昌",2020-08-04,2020-08-04,2022-02-22,,https://patents.google.com/patent/CN114079921A/en,https://patentimages.storage.googleapis.com/0c/a6/21/22cd24246e199f/HDA0002617192140000011.png
CN-114360118-A,Access control system based on block chain and processing method ,上海万向区块链股份公司,"修俊峰, 蒋鼎峰",2022-02-15,2022-02-15,2022-04-15,,https://patents.google.com/patent/CN114360118A/en,https://patentimages.storage.googleapis.com/f6/08/c9/0067865aac0b8c/HDA0003505549360000011.png
CN-111901359-A,"Resource account authorization method, device, system, computer equipment and medium ",广州运通链达金服科技有限公司,"邹均, 李�远, 徐俊, 蔡梦欢",2020-08-07,2020-08-07,2020-11-06,,https://patents.google.com/patent/CN111901359A/en,https://patentimages.storage.googleapis.com/03/b6/b2/298705028cdb7b/HDA0002623010290000011.png
CN-114172665-A,Block chain zero trust system and method for block chain zero trust system ,东软集团股份有限公司,"刘思瀚, 徐石成, 何光宇, 赵赫",2021-12-07,2021-12-07,2022-03-11,,https://patents.google.com/patent/CN114172665A/en,https://patentimages.storage.googleapis.com/fa/01/0d/d16a18b920890f/HDA0003397091640000011.png
CN-115601053-A,Back-to-back origin place certification safety credible protection method and equipment ,"山东浪潮质量链科技有限公司（Cn）, 山东浪潮质量链科技有限公司","王晓明, 肖雪, 商广勇, 李程, 刘宁, 马振",2022-12-16,2022-12-16,2023-01-13,,https://patents.google.com/patent/CN115601053A/en,https://patentimages.storage.googleapis.com/32/86/4a/18f303d07bb0cf/221123151700.png
CN-115906181-A,"Encrypted file right confirming method, device and system based on block chain attribute ",中国工商银行股份有限公司,"罗强, 刘朝伟, 江洪, 李曼潇",2022-12-30,2022-12-30,2023-04-04,,https://patents.google.com/patent/CN115906181A/en,https://patentimages.storage.googleapis.com/2b/a3/ed/f3960ca286d838/HDA0004031289910000011.png
CN-111932317-A,"Block chain based advertisement playing method, device, medium and electronic equipment ",腾讯科技（深圳）有限公司,冯峰,2020-09-15,2020-09-15,2020-11-13,,https://patents.google.com/patent/CN111932317A/en,https://patentimages.storage.googleapis.com/1b/3d/c6/4e75ecfc9651d0/200908175611.png
CN-115150109-A,"Authentication method, device and related equipment ","中移(上海)信息通信科技有限公司, 中移智行网络科技有限公司, 中国移动通信集团有限公司","郭清华, 严炜, 杨海涛",2021-03-29,2021-03-29,2022-10-04,,https://patents.google.com/patent/CN115150109A/en,https://patentimages.storage.googleapis.com/c2/f9/2a/466a99145befaf/HDA0002997476650000011.png
CN-116233141-A,Penetration type right confirming and supervising method and system based on master-slave multi-chain ,"中原工学院, 嵩山实验室","潘恒, 岳鹏帆, 陈鸿昶, 杨德仕, 卫红权, 丁大钊",2022-12-24,2022-12-24,2023-06-06,,https://patents.google.com/patent/CN116233141A/en,https://patentimages.storage.googleapis.com/0c/c0/9f/d3240a91610ed8/HDA0004015602610000011.png
CN-113206857-A,Data authentication method and system based on block chain ,光载无限（北京）科技有限公司,徐进平,2021-05-12,2021-05-12,2021-08-03,,https://patents.google.com/patent/CN113206857A/en,https://patentimages.storage.googleapis.com/96/0b/3c/ce375f0492877e/210512092621.png
CN-113420083-A,Heterogeneous parallel block chain structure with expandable distributed account book ,湖南大学,"马超群, 陈勋奇, 米先华, 周中定, 李信儒, 兰秋军, 万丽",2021-06-02,2021-06-02,2021-09-21,,https://patents.google.com/patent/CN113420083A/en,https://patentimages.storage.googleapis.com/5f/99/ed/f7979d024deb7b/HDA0003096139730000011.png
CN-113360948-A,Method and device for protecting user secret data ,令牌云(上海)科技有限公司,"肖鑫磊, 陈建伟, 唐晓玲, 师文杰, 刘鹤",2021-06-30,2021-06-30,2021-09-07,,https://patents.google.com/patent/CN113360948A/en,https://patentimages.storage.googleapis.com/d6/cf/1c/48dc24aecfd6d9/HDA0003137197980000011.png
CN-116205682-A,Advertisement monitoring method and device and computer readable storage medium ,中国联合网络通信集团有限公司,"穆晓君, 孙进芳",2021-11-29,2021-11-29,2023-06-02,,https://patents.google.com/patent/CN116205682A/en,https://patentimages.storage.googleapis.com/1e/76/0c/305d74d35a747f/HDA0003380998470000011.png
CN-114329585-A,Safety supervision platform architecture ,中电科大数据研究院有限公司,"管桂林, 谢真强, 程序, 田懿",2021-12-23,2021-12-23,2022-04-12,,https://patents.google.com/patent/CN114329585A/en,https://patentimages.storage.googleapis.com/e9/66/8d/6d7f6180910060/HDA0003430226750000011.png
CN-114679269-A,"Block chain-based credential transmission method and apparatus, electronic device, and storage medium ",中国工商银行股份有限公司,"夏韵, 黄文韬, 刘朝伟, 夏琼",2022-03-29,2022-03-29,2022-06-28,,https://patents.google.com/patent/CN114679269A/en,https://patentimages.storage.googleapis.com/66/1c/f7/a602b10cfaf14f/HDA0003571061670000011.png
CN-113469854-A,"Information sharing system and method, medium and electronic device ",光载互联(杭州)科技有限公司,"李骁宇, 张先国, 苑海鑫, 汤书亚",2021-06-22,2021-06-22,2021-10-01,,https://patents.google.com/patent/CN113469854A/en,https://patentimages.storage.googleapis.com/e0/f2/40/ecc605c6105855/RE-210907171518.png
CN-115170016-A,Abnormal service processing method and device based on block chain ,蚂蚁区块链科技(上海)有限公司,"刘佳伟, 江山, 金戈",2022-06-07,2022-06-07,2022-10-11,,https://patents.google.com/patent/CN115170016A/en,https://patentimages.storage.googleapis.com/ab/7f/56/d83bcfbc4fae7a/HDA0003681942600000011.png
CN-114780968-A,Intelligent contract upgrading method and device ,"国网区块链科技(北京)有限公司, 国网数字科技控股有限公司, 国网北京市电力公司, 国网江苏省电力有限公司南京供电分公司, 国家电网有限公司","王栋, 郭庆雷, 王伟贤, 段婷婷, 陈帅, 周冬旭, 严嘉慧, 施萱轩, 张禄, 王文帝, 李香龙, 朱正谊, 潘鸣宇",2022-06-23,2022-06-23,2022-07-22,,https://patents.google.com/patent/CN114780968A/en,https://patentimages.storage.googleapis.com/27/8b/55/931ad5154d4ad7/2206101641591.png
CN-116579015-A,Standard rating method based on blockchain ,河北雄安峰和科技有限公司,"鲍文学, 朱皓罡, 董蕾",2023-05-15,2023-05-15,2023-08-11,,https://patents.google.com/patent/CN116579015A/en,
CN-113779604-A,"Business service implementation method, device, equipment and storage medium based on block chain ",网易（杭州）网络有限公司,"王挺, 胡志鹏, 顾费勇, 曹崇瑞, 李刚锐",2021-09-13,2021-09-13,2021-12-10,,https://patents.google.com/patent/CN113779604A/en,https://patentimages.storage.googleapis.com/c1/60/12/a7303184364e4c/HDA0003260152080000011.png
CN-115694865-A,Method and device for processing extranet access ,中国工商银行股份有限公司,"马欢, 李思航, 胡谦谦, 刘洁琦",2022-06-30,2022-06-30,2023-02-03,,https://patents.google.com/patent/CN115694865A/en,https://patentimages.storage.googleapis.com/4a/36/72/fdf0af669cf0ab/HDA0003722565950000011.png
CN-115664759-A,User data sharing method and device ,"中钞信用卡产业发展有限公司, 中国印钞造币集团有限公司","平庆瑞, 张一锋",2022-10-19,2022-10-19,2023-01-31,,https://patents.google.com/patent/CN115664759A/en,https://patentimages.storage.googleapis.com/80/7d/ac/357fd663ed085a/HDA0003897962680000011.png
CN-115619402-A,Decentralized authored content consumption service system and method ,上海万向区块链股份公司,"杜宇, 侯东圣, 郝玉琨",2022-10-25,2022-10-25,2023-01-17,,https://patents.google.com/patent/CN115619402A/en,https://patentimages.storage.googleapis.com/cc/01/ec/4c8f0524536759/HDA0003907715660000011.png
CN-115714680-A,Domain name safety protection method based on block chain and computer equipment ,互联网域名系统北京市工程研究中心有限公司,"吴江洲, 黄辉, 陈政璋",2022-11-11,2022-11-11,2023-02-24,,https://patents.google.com/patent/CN115714680A/en,https://patentimages.storage.googleapis.com/17/52/17/e941535a9f38fd/HDA0003939394810000011.png
CN-115545936-A,Multi-chain management method and system ,北京共识数信科技有限公司,"王毛路, 闫发腾, 于丹, 李明",2022-11-22,2022-11-22,2022-12-30,,https://patents.google.com/patent/CN115545936A/en,https://patentimages.storage.googleapis.com/af/80/a9/4768df97505249/221111150129.png
CN-116341018-A,Government affair data resource management method and device based on blockchain ,广西壮族自治区信息中心,"彭新永, 周飞, 赵钦, 商广勇, 蔡耀君",2022-12-06,2022-12-06,2023-06-27,,https://patents.google.com/patent/CN116341018A/en,https://patentimages.storage.googleapis.com/9a/d6/c7/f1673b75a81389/HDA0003983350940000011.png
CN-116027895-A,"Virtual content interaction method, device, equipment and storage medium ",深圳市中视动科技有限公司,孔国良,2022-12-05,2022-12-05,2023-04-28,,https://patents.google.com/patent/CN116027895A/en,https://patentimages.storage.googleapis.com/92/b5/b6/86fe907bd855e4/HDA0004004259650000011.png
CN-114640475-A,"Decentralized identity authentication method and device, computer equipment and storage medium ",广东省绿算技术有限公司,"孟坤, 梁裕培",2022-05-19,2022-05-19,2022-06-17,,https://patents.google.com/patent/CN114640475A/en,https://patentimages.storage.googleapis.com/13/0c/9e/01c810d84de32f/220518175405.png
JP-2022172864-A,"Device, method, and program for digital asset management ","日本電気株式会社, Nec Corp","貴之 渋谷, Takayuki Shibuya",2021-05-07,2021-05-07,2022-11-17,,https://patents.google.com/patent/JP2022172864A/en,https://patentimages.storage.googleapis.com/f5/9d/d8/ad327e6c7a3bcf/2022172864000002.png
CN-116151827-B,Digital wallet security system and double off-line transaction method based on security system ,北京银联金卡科技有限公司,"杨波, 张彦超, 佟冬",2023-04-04,2023-04-04,2023-07-14,2023-07-14,https://patents.google.com/patent/CN116151827B/en,https://patentimages.storage.googleapis.com/84/89/52/b86de827065e04/FT_2.png
CN-115907769-A,"Identity authentication method, system and terminal based on block chain and autonomous identity recognition technology ",郑文伟,郑文伟,2022-11-18,2022-11-18,2023-04-04,,https://patents.google.com/patent/CN115907769A/en,https://patentimages.storage.googleapis.com/4a/f1/04/55a4c66ef28609/HDA0003950013900000011.png
