US-2023254302-A1,Authentication of device in network using cryptographic certificate ,"ANDRO Computational Solutions, LLC","Keyvan Ramezanpour, Jithin Jagannath, Anu Jagannath, Andrew Louis Drozd",2022-02-08,2023-02-07,2023-08-10,,https://patents.google.com/patent/US20230254302A1/en,https://patentimages.storage.googleapis.com/5c/47/90/b4576496dc1652/US20230254302A1-20230810-D00000.png
WO-2023062460-A1,System for secure acquisition of photographs of human faces ,Secom Srl,"Fabrizio Pinto, Francesco PRINCI, Davide Amato, Antonio FINOCCHITO, Riccardo BELLINTANI, Giuseppe CASTELLUCCI, Domenico Antonio PRINCI",2021-10-14,2022-09-19,2023-04-20,,https://patents.google.com/patent/WO2023062460A1/en,
US-2023153832-A1,Tokenizing scarce goods with provenance history bound to biological fingerprints ,"Numéraire Financial, Inc.","Alexander Lipton, Thomas P. Hardjono",2021-10-26,2023-01-06,2023-05-18,,https://patents.google.com/patent/US20230153832A1/en,https://patentimages.storage.googleapis.com/11/24/b7/8c22d3ce1a7827/US20230153832A1-20230518-D00000.png
US-2022191048-A1,"Cryptographically Verifiable, Portable Certificate ",Guardtime Sa,"Garrett DAY, Gregory RAYMOND",2020-12-10,2021-12-10,2022-06-16,,https://patents.google.com/patent/US20220191048A1/en,https://patentimages.storage.googleapis.com/ad/47/b7/fe90a09c423d6f/US20220191048A1-20220616-D00000.png
US-2023073938-A1,Systems and methods for use in implementing self-sovereign credentials ,Mastercard International Incorporated,"Bryn Anthony Robinson-Morgan, Liang Tian, Prashant Sharma",2021-08-31,2022-08-30,2023-03-09,,https://patents.google.com/patent/US20230073938A1/en,https://patentimages.storage.googleapis.com/1e/e3/8d/ed2ca39df72f74/US20230073938A1-20230309-D00000.png
WO-2022232184-A1,Tokenized media content management ,"Tunego, Inc.","Mark Goldston, Stacy Haitsuka, John Kohl, Ofek Hayon, Harold Mackenzie",2021-04-26,2022-04-26,2022-11-03,,https://patents.google.com/patent/WO2022232184A1/en,
US-2023051854-A1,Multi-chain credential management and retrieval of lost credential ,Vlinder Inc.,"Kaliraj Subra Manian, Gururaja Narayana, Chezhyan Panneerselvam",2021-04-03,2022-04-03,2023-02-16,,https://patents.google.com/patent/US20230051854A1/en,https://patentimages.storage.googleapis.com/b1/d9/2b/c2405137eb2081/US20230051854A1-20230216-D00000.png
CN-116244758-A,"Electronic contract solidifying method, device, equipment and storage medium based on block chain ","国网数字科技控股有限公司, 国网区块链科技(北京)有限公司, 国网宁夏电力有限公司, 国网宁夏电力有限公司电力科学研究院, 国家电网有限公司","杨珂, 陈鹏, 王合建, 郭庆雷, 杨成, 薛文昊, 潘晓婷, 李永亮, 高博, 李学锋",2023-03-10,2023-03-10,2023-06-09,,https://patents.google.com/patent/CN116244758A/en,https://patentimages.storage.googleapis.com/5b/11/dd/776e2118ed280d/HDA0004128379010000011.png
CN-115952527-A,"Data authorization, extraction and verification method, device, equipment and medium thereof ",北京百度网讯科技有限公司,荆博,2023-03-09,2023-03-09,2023-04-11,,https://patents.google.com/patent/CN115952527A/en,https://patentimages.storage.googleapis.com/fd/6a/56/cd43219f984791/FT_1.png
US-2023237499-A1,Non-fungible preference token ,"Salesforce, Inc.",Prithvi Krishnan Padmanabhan,2022-01-26,2023-01-24,2023-07-27,,https://patents.google.com/patent/US20230237499A1/en,https://patentimages.storage.googleapis.com/55/e6/46/eed2e7c8e022eb/US20230237499A1-20230727-D00000.png
CN-116248628-A,Third party account information management method and user authentication method ,浙江毫微米科技有限公司,"孔剑平, 胡楠, 王琪, 李炳博",2022-12-16,2022-12-16,2023-06-09,,https://patents.google.com/patent/CN116248628A/en,https://patentimages.storage.googleapis.com/61/a8/15/1ce4739acbe142/HDA0004004428850000011.png
CN-112837037-A,Method for realizing credit bank based on block chain technology ,北京中科云泮智能科技有限公司,郭朝晖,2021-02-06,2021-02-06,2021-05-25,,https://patents.google.com/patent/CN112837037A/en,https://patentimages.storage.googleapis.com/86/56/96/1bbc0833fbff08/HDA0002937510980000011.png
CN-114266062-A,"Structured information encryption system, method, device, medium and equipment ",中国电信股份有限公司,庄进宇,2021-12-28,2021-12-28,2022-04-01,,https://patents.google.com/patent/CN114266062A/en,https://patentimages.storage.googleapis.com/e4/7c/1e/331929398798e4/HDA0003439715250000011.png
US-2023281638-A1,Decentralized services platform ,Hewlett Packard Enterprise Development Lp,"Sebastian Kaiser, Marcus Friedrich, Hartmut Schultze, Florian Buehr",,2022-03-07,2023-09-07,,https://patents.google.com/patent/US20230281638A1/en,https://patentimages.storage.googleapis.com/US20230281638A1/US20230281638A1-20230907-D00000.png
CN-114463007-A,"Close-range payment method, medium, device and computing equipment ",网易宝有限公司,"潘威, 熊旭, 牛魁元, 余洋, 刘庆生",2022-02-08,2022-02-08,2022-05-10,,https://patents.google.com/patent/CN114463007A/en,https://patentimages.storage.googleapis.com/16/f8/76/42bbbaf430d70a/HDA0003497180710000011.png
CN-115482897-A,Medical information sharing method and device based on block chain ,浪潮工业互联网股份有限公司,"冉悦, 肖雪, 商广勇, 李程, 刘宁, 马振",2022-09-20,2022-09-20,2022-12-16,,https://patents.google.com/patent/CN115482897A/en,https://patentimages.storage.googleapis.com/ff/f2/c3/3b064220589d22/HDA0003853643380000011.png
US-2023055584-A1,Cryptocurrency using digitally locked coins ,"Darrion Vinh Nguyen, Khanh Nguyen, Hao-Nhien Qui Vu, Anthony Justin Nguyen","Darrion Vinh Nguyen, Khanh Nguyen, Hao-Nhien Qui Vu, Anthony Justin Nguyen",2021-08-17,2021-08-17,2023-02-23,,https://patents.google.com/patent/US20230055584A1/en,https://patentimages.storage.googleapis.com/64/36/30/f6b3ef37b78f07/US20230055584A1-20230223-D00000.png
CN-115830774-A,Sharing system for helmet of operator in specific control area ,"中国人民解放军火箭军研究院核技术研究所, 中国船舶集团有限公司第七一六研究所","丁健, 葛爱学, 李徽, 陶林, 魏继华, 廖波, 熊柯, 范宏深, 王栋耀, 马仁军",2022-10-28,2022-10-28,2023-03-21,,https://patents.google.com/patent/CN115830774A/en,https://patentimages.storage.googleapis.com/d7/a1/7d/bcda0f26a9bb34/HDA0003915365720000011.png
CN-116305183-A,"Data processing method, data processing end, storage medium and electronic equipment ",北京数字认证股份有限公司,"赵松, 王翀, 陈澍, 王震, 王银平",2023-01-05,2023-01-05,2023-06-23,,https://patents.google.com/patent/CN116305183A/en,https://patentimages.storage.googleapis.com/e8/60/ff/5a409e9b00d3f8/HDA0004038763590000011.png
CN-116321154-A,Efficient message authentication method based on zero knowledge proof in Internet of vehicles environment ,南通大学,"曹利, 李原帅, 张迪, 魏晓宁, 陈亮",2023-03-23,2023-03-23,2023-06-23,,https://patents.google.com/patent/CN116321154A/en,https://patentimages.storage.googleapis.com/ad/55/f2/a4bdf0de52b19f/HDA0004141685120000011.png
CN-116415217-A,Instant authorization system based on zero trust architecture ,"航天科工网络信息发展有限公司, 中国航天科工集团第二研究院","白亚南, 王鹏飞, 杜笑天, 温万里, 孙志鹏, 郑大国",2022-12-27,2022-12-27,2023-07-11,,https://patents.google.com/patent/CN116415217A/en,https://patentimages.storage.googleapis.com/80/f3/76/084b8e9b0c06b1/HDA0004018880610000011.png
CN-112887983-A,"Equipment identity authentication method, device, equipment and medium ",上海银基信息安全技术股份有限公司,"周游, 韩毅, 单宏寅",2021-01-27,2021-01-27,2021-06-01,,https://patents.google.com/patent/CN112887983A/en,https://patentimages.storage.googleapis.com/7c/91/5c/4b6daaec2261b4/HDA0002919792640000011.png
CN-114997853-A,Novel method for improving and optimizing book publishing mode by using meta-universe technology ,北京上方传媒科技股份有限公司,"张平, 王紫上, 颜桃, 贾涛",2022-05-23,2022-05-23,2022-09-02,,https://patents.google.com/patent/CN114997853A/en,https://patentimages.storage.googleapis.com/16/93/a6/86717f66215663/HDA0003657467190000011.png
CN-115119179-A,Vehicle management method and communication device ,华为技术有限公司,"李明超, 潘凯, 魏芳",2021-03-19,2021-03-19,2022-09-27,,https://patents.google.com/patent/CN115119179A/en,https://patentimages.storage.googleapis.com/a6/0b/f0/aaf88872921015/HDA0002983818970000011.png
WO-2022122759-A1,Method for subscribing to a banking direct debit mandate by way of a blockchain ,Bpce,"José LUU, Cyril Vignet, Loubna SASSOUI",2020-12-08,2021-12-07,2022-06-16,,https://patents.google.com/patent/WO2022122759A1/en,
CN-114826605-B,Data security sharing method and blockchain system based on quantum key distribution ,华南理工大学,"崔巍, 吴嘉豪",2022-03-28,2022-03-28,2023-08-18,2023-08-18,https://patents.google.com/patent/CN114826605B/en,
CN-113962692-A,Electronic children money deposit terminal based on digital RMB payment ,苏州成方云数字科技有限公司,吴文俊,2021-09-16,2021-09-16,2022-01-21,,https://patents.google.com/patent/CN113962692A/en,https://patentimages.storage.googleapis.com/e7/8f/52/2bb44010334760/210916102251.png
CN-115619398-A,Asset digital certificate generating and storing method based on alliance chain ,中农融信(北京)科技股份有限公司,"张丹丹, 刘毅, 李文超",2022-09-08,2022-09-08,2023-01-17,,https://patents.google.com/patent/CN115619398A/en,https://patentimages.storage.googleapis.com/8a/f1/da/64e21d4bb40d30/HDA0003838551140000011.png
CN-116094724-A,Registration and authentication method and device for electronic identity ,航天信息股份有限公司,"张志达, 黄鹏, 张科伟, 王璀, 毛翔宇, 孙永文, 龚晨",2022-12-30,2022-12-30,2023-05-09,,https://patents.google.com/patent/CN116094724A/en,https://patentimages.storage.googleapis.com/9b/db/0f/151276e4b39852/HDA0004029305750000011.png
CN-116388989-A,Distributed identity-based zero-trust single-package authentication system and method ,四川启睿克科技有限公司,"江佳峻, 陈伏娟",2022-12-12,2022-12-12,2023-07-04,,https://patents.google.com/patent/CN116388989A/en,https://patentimages.storage.googleapis.com/ce/e7/f1/973c470a1c248d/HDA0003993098720000011.png
CN-114266023-A,Block chain-based distributed identity authentication method and system ,上海万向区块链股份公司,宋雪彤,2021-12-28,2021-12-28,2022-04-01,,https://patents.google.com/patent/CN114266023A/en,https://patentimages.storage.googleapis.com/c7/6e/5e/0b100c5524284f/HDA0003440316540000011.png
US-2023127882-A1,Generating an inventory certificate for validation of information handling systems ,"Dell Products, L.P.","Jason Matthew YOUNG, A Anis Ahmed, Harmeet Singh, Gowree Sankara Rao Kurmana",2021-10-22,2021-10-22,2023-04-27,,https://patents.google.com/patent/US20230127882A1/en,https://patentimages.storage.googleapis.com/cd/7b/41/dcf1ecb3f2f5a7/US20230127882A1-20230427-D00000.png
CN-116383789-A,Information interaction method based on personal information service system ,杭州格物智安科技有限公司,"万志涛, 蔡民强",2023-06-06,2023-06-06,2023-07-04,,https://patents.google.com/patent/CN116383789A/en,https://patentimages.storage.googleapis.com/2a/0c/44/a6d732009fd9bf/FT_1.png
CN-116432220-A,"Host access control method, device, equipment and storage medium of numerical control system ","华中科技大学, 武汉华中数控股份有限公司","路松峰, 黄丽敏, 吴俊军, 代超仁, 冯冰艳, 彭世坤, 沈任飞, 邓晓旭",2023-03-15,2023-03-15,2023-07-14,,https://patents.google.com/patent/CN116432220A/en,https://patentimages.storage.googleapis.com/05/fc/d5/b1b589d9362c4c/HDA0004127670790000011.png
CN-116366717-A,"Electronic certificate pushing method, device, storage medium, terminal and server ",支付宝(杭州)信息技术有限公司,王晋阳,2023-02-14,2023-02-14,2023-06-30,,https://patents.google.com/patent/CN116366717A/en,https://patentimages.storage.googleapis.com/5c/0d/03/12be2ccf66a53e/HDA0004101987980000011.png
CN-116010361-A,"Electronic license storage method, device, equipment, medium and product ","中国建设银行股份有限公司, 建信金融科技有限责任公司","杨浩, 刘俊佳",2023-01-04,2023-01-04,2023-04-25,,https://patents.google.com/patent/CN116010361A/en,https://patentimages.storage.googleapis.com/1b/dd/69/edfbfe65ad59de/HDA0004037776940000011.png
CN-115987507-A,"Key generation method, device and medium based on MEMS ",上海交通大学,"王磊, 谢以豪",2022-12-28,2022-12-28,2023-04-18,,https://patents.google.com/patent/CN115987507A/en,https://patentimages.storage.googleapis.com/ba/ff/f2/87557e58ab3d57/HDA0004024488470000011.png
CN-116347454-A,Block chain spectrum sharing method based on directed acyclic graph ,电子科技大学,"张科, 解晋, 李晶晶, 赵睿溪",2022-12-09,2022-12-09,2023-06-27,,https://patents.google.com/patent/CN116347454A/en,https://patentimages.storage.googleapis.com/77/75/3b/a87d9542ae3ed6/HDA0003989977020000011.png
CN-116248318-A,"Call chain generation method, device, electronic equipment and storage medium ",中国电信股份有限公司,"李玲玲, 张伟涛, 郑文晖, 于增光, 沈苏楠",2022-12-08,2022-12-08,2023-06-09,,https://patents.google.com/patent/CN116248318A/en,https://patentimages.storage.googleapis.com/6b/90/6a/ac6fc67f8f91e0/HDA0003987500580000011.png
CN-116527237-A,Block chain predictor for real-time evidence storage ,"北京天德科技有限公司, 天民(青岛)国际沙盒研究院有限公司",蔡维德,2022-11-11,2022-11-11,2023-08-01,,https://patents.google.com/patent/CN116527237A/en,
CN-115099976-A,Intellectual property intelligent transaction method and system with information security protection ,北京乐享研创科技有限公司,李晓龙,2022-07-26,2022-07-26,2022-09-23,,https://patents.google.com/patent/CN115099976A/en,https://patentimages.storage.googleapis.com/15/0f/da/3c931b46a94857/HSA0000279219930000011.png
CN-115174247-A,Object tracking method and device based on block chain and electronic equipment ,中国工商银行股份有限公司,"罗强, 黄肇敏, 夏琼, 曾钊创",2022-07-18,2022-07-18,2022-10-11,,https://patents.google.com/patent/CN115174247A/en,https://patentimages.storage.googleapis.com/a9/55/76/4207a916d52879/HDA0003751438300000011.png
CN-115129835-A,"Session processing method, device, computer equipment and storage medium ",腾讯科技（深圳）有限公司,"张雪, 王旭东, 曹源, 温东坡",2022-05-25,2022-05-25,2022-09-30,,https://patents.google.com/patent/CN115129835A/en,https://patentimages.storage.googleapis.com/ad/82/13/3349e9c788c02e/HDA0003660853220000011.png
CN-114389810-A,"Certificate generation method and device, electronic device and storage medium ",蚂蚁区块链科技(上海)有限公司,"林渝淇, 魏长征",2022-02-25,2022-02-25,2022-04-22,,https://patents.google.com/patent/CN114389810A/en,https://patentimages.storage.googleapis.com/b3/b4/d3/37439e2d909053/HDA0003521724730000011.png
CN-114301608-A,Block chain decentralized multi-element cross consensus signature lock and access control construction method ,鄢华中,鄢华中,2021-12-31,2021-12-31,2022-04-08,,https://patents.google.com/patent/CN114301608A/en,https://patentimages.storage.googleapis.com/20/9e/f9/3748d1e73e3476/HDA0003452476920000011.png
CN-114268508-A,"Internet of things equipment secure access method, device, equipment and medium ",天翼物联科技有限公司,"张艳霞, 胡豆豆, 房新彦, 罗思维, 璞岚",2021-12-30,2021-12-30,2022-04-01,,https://patents.google.com/patent/CN114268508A/en,https://patentimages.storage.googleapis.com/44/29/32/579b64ab5f0804/HDA0003445674210000011.png
KR-20220013328-A,Method for authenticating user contactlessly based on decentralized identifier using verifiable credential and authentication supporting server using the same ,주식회사 코인플러그,"어준선, 서문규, 송주한",2020-07-24,2021-07-20,2022-02-04,,https://patents.google.com/patent/KR20220013328A/en,https://patentimages.storage.googleapis.com/97/93/9f/45f75dd0980528/pat00001.png
CN-115456638-A,Second-hand mobile phone transaction traceability system and transaction method based on blockchain ,南京理工大学,"徐纯根, 张功萱",2021-06-09,2021-06-09,2022-12-09,,https://patents.google.com/patent/CN115456638A/en,https://patentimages.storage.googleapis.com/0d/59/be/f970f7a31dca3d/HDA0003108221840000011.png
CN-113407158-A,Basic chain bottom layer architecture system and method based on block chain ,福建中科星泰数据科技有限公司,魏良峰,2021-05-11,2021-05-11,2021-09-17,,https://patents.google.com/patent/CN113407158A/en,https://patentimages.storage.googleapis.com/78/63/bf/2e98b6c584d989/HDA0003060388180000011.png
BR-102021007907-A2,SMART MEDIA PROTOCOL METHOD A MEDIA ID FOR ACCOUNTABILITY AND AUTHENTICATION ,André Augusto Ceballos Melo,André Augusto Ceballos Melo,2021-04-26,2021-04-26,2022-11-01,,https://patents.google.com/patent/BR102021007907A2/en,
CN-115203730-A,"Information processing method and device, client, network node and resource service equipment ","中国移动通信有限公司研究院, 中国移动通信集团有限公司","杨波, 王珂, 阎军智, 庄小君",2021-04-12,2021-04-12,2022-10-18,,https://patents.google.com/patent/CN115203730A/en,https://patentimages.storage.googleapis.com/6c/b1/3c/893f77d5038d3f/HDA0003016158040000011.png
CN-112785422-A,"Enterprise bond financing method, device and medium based on block chain ",湖南大学,"马超群, 孙霖, 米先华, 周中定, 李信儒, 兰秋军, 万丽",2021-01-28,2021-01-28,2021-05-11,,https://patents.google.com/patent/CN112785422A/en,https://patentimages.storage.googleapis.com/fe/3a/25/515e7e557039a3/HDA0002921966510000011.png
CN-114520723-A,Novel method and device for guaranteeing reliability of handwritten electronic signature ,上海铠射信息科技有限公司,李华,2020-11-19,2020-11-19,2022-05-20,,https://patents.google.com/patent/CN114520723A/en,https://patentimages.storage.googleapis.com/00/41/e6/854694f2c54c79/201119162853.png
CN-115803736-A,"File generation method and device in Internet of things, computer equipment and storage medium ",Oppo广东移动通信有限公司,"吕小强, 曾春亮, 张军, 茹昭, 翟召轩, 吴泰月, 杨启昌, 陈泽春, 余振荣, 陈钊",2020-08-31,2020-08-31,2023-03-14,,https://patents.google.com/patent/CN115803736A/en,https://patentimages.storage.googleapis.com/23/3a/2d/63c2044949469b/PCTCN2020112731-APPB-300001.png
CZ-2020283-A3,A method of transmitting a large amount of data via a cyclic 2D code off-line ,"ODP-software, spol. s r. o.","Vojtěch Matocha, Vojtěch Mgr. Matocha",2020-05-19,2020-05-19,2021-12-01,,https://patents.google.com/patent/CZ2020283A3/en,
CN-112883752-B,"Two-dimensional code scanning method, device and equipment ",支付宝(杭州)信息技术有限公司,薛传宗,2021-02-04,2021-02-04,2023-05-09,2023-05-09,https://patents.google.com/patent/CN112883752B/en,https://patentimages.storage.googleapis.com/cc/12/3d/0b9139a0690461/HDA0002934898440000011.png
CN-112134867-B,User behavior storage system based on block chain and uplink authorization confirming method thereof ,重庆鸿荣源智能科技有限公司,邹发安,2020-09-15,2020-09-15,2023-04-07,2023-04-07,https://patents.google.com/patent/CN112134867B/en,https://patentimages.storage.googleapis.com/f8/ac/e7/406dad5d15a6e3/HDA0002683435510000011.png
US-2023281449-A1,"Architectures, systems and methods for program defined transaction system and decentralized cryptocurrency systems ","Milestone Entertainment, LLC","Randall M. Katz, Robert Tercek",,2023-05-12,2023-09-07,,https://patents.google.com/patent/US20230281449A1/en,https://patentimages.storage.googleapis.com/US20230281449A1/US20230281449A1-20230907-D00000.png
US-2023281450-A1,"Architectures, systems and methods having segregated secure and public functions ","Milestone Entertainment, LLC","Randall M. Katz, Robert Tercek",,2023-05-12,2023-09-07,,https://patents.google.com/patent/US20230281450A1/en,https://patentimages.storage.googleapis.com/US20230281450A1/US20230281450A1-20230907-D00000.png
US-2023281604-A1,Technologies for creating and transferring non-fungible token based identities ,"Fortior Solutions, Llc","James Frederick ROBELL, James G. HART, Qui Quoc HOANG, Viet Quoc HOANG",,2023-02-28,2023-09-07,,https://patents.google.com/patent/US20230281604A1/en,https://patentimages.storage.googleapis.com/US20230281604A1/US20230281604A1-20230907-D00000.png
US-2023283714-A1,Coordinating conveying a reason for a call from a user device ,Journey.ai,"Michael Joseph Frendo, Alexander John Shockley, Brett Shockley, Robert Taylor Bartlett, Shmuel Shaffer",,2023-02-22,2023-09-07,,https://patents.google.com/patent/US20230283714A1/en,https://patentimages.storage.googleapis.com/US20230283714A1/US20230283714A1-20230907-D00000.png
DE-102021118998-A1,multifunctional day ,Eto Magnetic Gmbh,"Benjamin Bönisch, Tobias Plötzing, Walter Naumann",2021-07-22,2021-07-22,2023-01-26,,https://patents.google.com/patent/DE102021118998A1/en,https://patentimages.storage.googleapis.com/16/71/a9/b03d6125264f67/DE102021118998A1_0001.png
US-2023283713-A1,Conveying a reason for a call to a user device ,Journey.ai,"Michael Joseph Frendo, Alexander John Shockley, Brett Shockley, Robert Taylor Bartlett, Shmuel Shaffer",,2023-02-22,2023-09-07,,https://patents.google.com/patent/US20230283713A1/en,https://patentimages.storage.googleapis.com/US20230283713A1/US20230283713A1-20230907-D00000.png
US-2023154266-A1,Access management system ,1Ahead Technologies,Ronald Carter,2020-10-14,2023-01-20,2023-05-18,,https://patents.google.com/patent/US20230154266A1/en,https://patentimages.storage.googleapis.com/77/20/75/5aa6901ae47db9/US20230154266A1-20230518-D00000.png
EP-4216095-A1,System for providing sustainability-driven blockchain platform ,5ire LLP,"Vilma Mattila, Pratik Gauri, Prateek Dwivedi",2022-01-20,2023-01-19,2023-07-26,,https://patents.google.com/patent/EP4216095A1/en,https://patentimages.storage.googleapis.com/aa/a1/6f/b624cdb03c38c3/imgf0001.png
US-2023237172-A1,Data broker ,"Early Warning Services, Llc",Andrea Motto,2022-01-12,2023-01-11,2023-07-27,,https://patents.google.com/patent/US20230237172A1/en,https://patentimages.storage.googleapis.com/b9/17/77/e178804f897bab/US20230237172A1-20230727-D00000.png
DE-102022100411-A1,Verification method and verification computer system with an NFT creation device and a verification device ,Eto Gruppe Technologies Gmbh,Sharang Deepak Parnerkar,2022-01-10,2022-01-10,2023-07-13,,https://patents.google.com/patent/DE102022100411A1/en,https://patentimages.storage.googleapis.com/ad/c0/c1/a1ce9ff9dc690f/DE102022100411A1_0001.png
US-2023196347-A1,"Systems, methods and schema for cryptographic promissory files ","Emergent Financial, LLC",Ryan Michael Tate,2021-12-16,2022-12-16,2023-06-22,,https://patents.google.com/patent/US20230196347A1/en,https://patentimages.storage.googleapis.com/84/3c/db/a7c78282d1e1e2/US20230196347A1-20230622-D00000.png
US-2023139137-A1,Tokenized carbon credit trading platform ,Carbon2o2 LLC,Harry Slack,2021-11-01,2022-10-25,2023-05-04,,https://patents.google.com/patent/US20230139137A1/en,https://patentimages.storage.googleapis.com/32/b3/ab/a94489dbc83ed6/US20230139137A1-20230504-D00000.png
US-2023101514-A1,Platform providing catered selection of events and real-time event information ,"Make Your Life Entertaining, Inc.","Kevin Lloyd, Sherry Bean-Lloyd",2021-09-30,2022-09-30,2023-03-30,,https://patents.google.com/patent/US20230101514A1/en,https://patentimages.storage.googleapis.com/19/1e/c1/afb7001a3a9d38/US20230101514A1-20230330-D00000.png
WO-2021150163-A1,Storage virtualization architecture with hybrid blockchain and the method thereof ,The Flowchain Foundation Limited,Jun-hong CHEN,2020-01-22,2020-01-22,2021-07-29,,https://patents.google.com/patent/WO2021150163A1/en,
US-2023055736-A1,System and method for a distributed ledger tracking animals ,Pondata LLC,Justin Oberg,2021-08-17,2022-08-17,2023-02-23,,https://patents.google.com/patent/US20230055736A1/en,https://patentimages.storage.googleapis.com/f2/95/d4/0bff1fa03fafaa/US20230055736A1-20230223-D00000.png
US-2023237290-A1,Relabeling-resistant item identifiers used across domains ,"Cisco Technology, Inc.","Marcelo Yannuzzi, John Monaghan, Joel Abraham Obstfeld",2022-01-25,2022-01-25,2023-07-27,,https://patents.google.com/patent/US20230237290A1/en,https://patentimages.storage.googleapis.com/e0/13/62/c6fd433110e1c5/US20230237290A1-20230727-D00000.png
US-2023237422-A1,Cross-organization tracking identifier space allocation for supply chains ,"Cisco Technology, Inc.","Marco TRINELLI, Marcelo Yannuzzi, Bart Brinckman",2022-01-24,2022-01-24,2023-07-27,,https://patents.google.com/patent/US20230237422A1/en,https://patentimages.storage.googleapis.com/d0/50/59/c062c87c533fb6/US20230237422A1-20230727-D00000.png
EP-4209944-A1,A user authentication based on a blockchain ,Nokia Technologies Oy,"Marc Van Den Broeck, Utku Gunay Acer, Akhil MATHUR, Fahim Kawsar, Chulhong Min, Alessandro Montanari",2022-01-10,2022-01-10,2023-07-12,,https://patents.google.com/patent/EP4209944A1/en,https://patentimages.storage.googleapis.com/d3/e9/fe/2e923491d6f85f/imgf0001.png
US-2022180416-A1,Method and System for Facilitating a Marketplace for Labor Arbitrage ,"Bill Borden Shook, David Cho","Bill Borden Shook, David Cho",2020-11-24,2021-11-24,2022-06-09,,https://patents.google.com/patent/US20220180416A1/en,https://patentimages.storage.googleapis.com/24/e4/14/117e07a10685ae/US20220180416A1-20220609-D00000.png
