CN-112767185-A,Reverse warranty financing method and device based on block chain and storage medium ,湖南大学,"马超群, 孙霖, 米先华, 周中定, 李信儒, 兰秋军, 万丽",2021-01-28,2021-01-28,2021-05-07,,https://patents.google.com/patent/CN112767185A/en,https://patentimages.storage.googleapis.com/b5/03/31/92eb462eda44a3/HDA0002921894780000011.png
US-11606188-B1,"Systems for multi-blockchain, multi-token interoperability via common blockchain integration ",Tassat Group Inc.,"Kevin Lupowitz, Eric Couillard, Sanjaya Kulkarni, Brian Bruce, Sanjay Deshpande, Omari Edwards, Joe Grastara, Al Gleicher",2022-02-03,2022-05-27,2023-03-14,2023-03-14,https://patents.google.com/patent/US11606188B1/en,https://patentimages.storage.googleapis.com/1d/2e/ac/a539db5ba7c814/US11606188-20230314-D00000.png
US-11366897-B1,Systems and methods for layered quantum computing detection ,"Wells Fargo Bank, N.A.","Ramanathan Ramanathan, Andrew J. Garner, IV, Abhijit Rao, Pierre ARBADJIAN, Michael Erik MEINHOLZ, Omar B. Khan, Ramesh Yarlagadda",2020-01-17,2020-01-17,2022-06-21,2022-06-21,https://patents.google.com/patent/US11366897B1/en,https://patentimages.storage.googleapis.com/20/6c/7b/4c4b815eb6e8ae/US11366897-20220621-D00000.png
CN-111681007-A,"Credit scoring method for block chain, transaction method and related device ",中国工商银行股份有限公司,"岑健明, 苏恒, 刘朝伟, 李曼潇",2020-05-28,2020-05-28,2020-09-18,,https://patents.google.com/patent/CN111681007A/en,https://patentimages.storage.googleapis.com/a9/f6/02/05ca145ff14824/HDA0002514159790000011.png
EP-3876127-A1,Remote device maintenance based on distributed data storage ,"Bundesdruckerei GmbH, neXenio GmbH","Maxim Schnjakin, Philipp Berger, Patrick Hennig, René MEUSEL, Daniel MORITZ, Harald Fladischer",2020-03-05,2021-03-04,2021-09-08,,https://patents.google.com/patent/EP3876127A1/en,https://patentimages.storage.googleapis.com/95/a0/13/faadade2664767/imgf0001.png
US-11405200-B1,Multilevel split keys for wallet recovery ,"Workday, Inc.","Bjorn Hamel, Prakash Sundaresan",2020-05-21,2020-05-21,2022-08-02,2022-08-02,https://patents.google.com/patent/US11405200B1/en,https://patentimages.storage.googleapis.com/98/11/d8/0a60573cf16908/US11405200-20220802-D00000.png
US-11223470-B1,Post-quantum cryptography side chain ,"Wells Fargo Bank, N.A.","Brad A. Shea, Jeff J. Stapleton, Robert L. Carter, Jr., Pierre Arbajian, Peter Bordow, Michael Erik MEINHOLZ",2020-03-06,2020-03-06,2022-01-11,2022-01-11,https://patents.google.com/patent/US11223470B1/en,https://patentimages.storage.googleapis.com/40/57/d1/4d18a4afe29ca5/US11223470-20220111-D00000.png
US-11218471-B1,Systems and methods for quantum consensus ,"Wells Fargo Bank, N.A.","Jeff J. Stapleton, Robert L. Carter, Jr., Pierre Arbajian, Bradford A. SHEA, Peter Bordow, Michael Erik MEINHOLZ",2020-02-11,2020-02-11,2022-01-04,2022-01-04,https://patents.google.com/patent/US11218471B1/en,https://patentimages.storage.googleapis.com/2e/79/00/694acdbe131b50/US11218471-20220104-D00000.png
CN-114866260-B,Chameleon hash distributed identity using method and system ,杭州天谷信息科技有限公司,"钟一民, 陈传义, 郭峰, 金宏洲, 程亮",2022-07-05,2022-07-05,2022-10-28,2022-10-28,https://patents.google.com/patent/CN114866260B/en,https://patentimages.storage.googleapis.com/cd/79/69/2fa2d15c780a12/220628134639.png
US-2021297252-A1,Rapid cryptography methods and devices for secure data access ,Princeton Biocode Inc.,"D.C. Licciardello, Robert H. Austin, Johannes Dapprich, Paul Lewis, Glenn Paul",2020-03-18,2021-03-18,2021-09-23,,https://patents.google.com/patent/US20210297252A1/en,https://patentimages.storage.googleapis.com/ee/75/08/879f1b6b188543/US20210297252A1-20210923-D00000.png
CN-112862576-A,"Bidding auction method, system, equipment and storage medium based on block chain ",湖南大学,"马超群, 陈勋奇, 米先华, 周中定, 李信儒, 兰秋军, 万丽",2021-02-07,2021-02-07,2021-05-28,,https://patents.google.com/patent/CN112862576A/en,https://patentimages.storage.googleapis.com/b8/96/29/3da18b23f2679f/HDA0002938231320000011.png
CN-111831843-A,Block chain-based animal identity management method and system ,广东工业大学,"冷杰武, 林升言, 李龙章, 李春泽, 黄康敏, 林栩, 黄国桥, 林舒儿",2020-06-11,2020-06-11,2020-10-27,,https://patents.google.com/patent/CN111831843A/en,https://patentimages.storage.googleapis.com/d2/8f/d8/5e998a1c724c24/HDA0002535675660000011.png
CN-113850607-A,Data cross-chain transfer method and system based on distributed identity ,中国信息通信研究院,"李志平, 谢家贵, 郭健, 张波, 刘远超, 杨威",2021-11-29,2021-11-29,2021-12-28,,https://patents.google.com/patent/CN113850607A/en,https://patentimages.storage.googleapis.com/71/f7/25/8516318b84f943/211105161820.png
US-2022060329-A1,Method and system for digital voting using a trusted digital voting platform ,The Pitroda Group LLC.,"Alexandre Goguin, Satyan Pitroda, Rakesh Patel",2020-08-19,2021-08-19,2022-02-24,,https://patents.google.com/patent/US20220060329A1/en,https://patentimages.storage.googleapis.com/33/0a/31/c154ec3bd8ecda/US20220060329A1-20220224-D00000.png
CN-111797373-A,"Method, system, computer device and readable storage medium for identity information authentication ",杭州云链趣链数字科技有限公司,"姜勇, 韩永楠, 陈宇峰",2020-07-08,2020-07-08,2020-10-20,,https://patents.google.com/patent/CN111797373A/en,https://patentimages.storage.googleapis.com/65/77/5b/87d13eb055f258/HDA0002574604800000011.png
CN-113225190-A,Quantum security digital signature method using new problem ,数字兵符(福州)科技有限公司,"苏盛辉, 吕述望",2021-02-08,2021-02-08,2021-08-06,,https://patents.google.com/patent/CN113225190A/en,
DE-102021127624-A1,SECURELY DEPLOYING THE IDENTITY OF A PLATFORM'S BASEBOARD MANAGEMENT CONTROLLER ,Hewlett Packard Enterprise Development Lp,"Nigel John Edwards, Luis E. Luciani, Ludovic Emmanuel Paul Noel JACQUIN",2021-03-01,2021-10-25,2022-09-01,,https://patents.google.com/patent/DE102021127624A1/en,https://patentimages.storage.googleapis.com/34/4c/e0/3448cd6fca6527/DE102021127624A1_0001.png
WO-2022091076-A1,"System, method and computer program product for authentication of digital service end-users ",Au10Tix Ltd.,"Ron ATZMON, Sergey MARKIN, Benjamin NEEMAN",2020-10-29,2021-10-06,2022-05-05,,https://patents.google.com/patent/WO2022091076A1/en,
CN-112818038-A,Data management method based on combination of block chain and IPFS (Internet protocol file system) and related equipment ,"山东伏羲智库互联网研究院, 伏羲科技(菏泽)有限公司","李晓东, 王伟, 张有宜, 王翠翠, 彭博韬",2021-02-02,2021-02-02,2021-05-18,,https://patents.google.com/patent/CN112818038A/en,https://patentimages.storage.googleapis.com/0a/86/28/5e32e66076dee1/HDA0002930325510000011.png
US-2021407002-A1,Systems and methods for intraday foreign exchange using distributed ledger technology ,"Jpmorgan Chase Bank, N.A.","Christine Moy, George KASSIS, Alex PRAGER-MILLER, Stuart Hunter, Scott Andrew LUCAS",2020-06-29,2021-06-29,2021-12-30,,https://patents.google.com/patent/US20210407002A1/en,https://patentimages.storage.googleapis.com/b4/5e/49/07ced9b2ab900f/US20210407002A1-20211230-D00000.png
CN-113515782-A,Personal track proving method based on block chain and zero-knowledge proving ,北京工业大学,"林绍福, 李昀辉",2021-06-18,2021-06-18,2021-10-19,,https://patents.google.com/patent/CN113515782A/en,https://patentimages.storage.googleapis.com/fa/23/45/db3728e3f3fadd/HDA0003120510640000011.png
CN-112769939-B,Big data reliable transmission method for real-time communication ,北京机电工程总体设计部,"孔福, 周杰, 孙林, 马光远, 张金涛, 胡乐乐",2021-01-13,2021-01-13,2023-03-21,2023-03-21,https://patents.google.com/patent/CN112769939B/en,
CN-113328854-A,Service processing method and system based on block chain ,杭州溪塔科技有限公司,"王晓亮, 俞之贝",2021-05-24,2021-05-24,2021-08-31,,https://patents.google.com/patent/CN113328854A/en,https://patentimages.storage.googleapis.com/56/07/eb/6228fb355485f4/HDA0003081136610000011.png
WO-2023077794-A1,"Blockchain access permission control method, and system, device, program and medium ",中国信息通信研究院,"张钰雯, 刘阳, 池程, 朱斯语, 田娟",2021-11-04,2022-06-06,2023-05-11,,https://patents.google.com/patent/WO2023077794A1/en,https://patentimages.storage.googleapis.com/3a/96/2a/13a7f338c7242d/PCTCN2022097168-appb-300001.png
CN-113541970-B,Method and system for using distributed identifier ,中国信息通信研究院,"李志平, 谢家贵, 张波, 郭健, 马旭锋",2021-09-17,2021-09-17,2021-11-26,2021-11-26,https://patents.google.com/patent/CN113541970B/en,https://patentimages.storage.googleapis.com/26/22/fa/4b7c88edc10990/210917095223.png
CN-112163801-A,Cargo warehouse management method and system based on block chain ,广东工业大学,"冷杰武, 黄国桥, 李龙章, 关圆, 周平林, 林泽鑫, 陈美霞",2020-09-01,2020-09-01,2021-01-01,,https://patents.google.com/patent/CN112163801A/en,https://patentimages.storage.googleapis.com/db/e4/43/47c308c2298ba9/HDA0002660268670000011.png
CN-111614690-B,Abnormal behavior detection method and device ,上海观安信息技术股份有限公司,"汲丽, 钱沁莹, 魏国富, 葛胜利, 钟丹阳",2020-05-28,2020-05-28,2022-10-11,2022-10-11,https://patents.google.com/patent/CN111614690B/en,https://patentimages.storage.googleapis.com/28/f8/88/0edeb7a2eecb14/HDA0002512535790000011.png
CN-111786795-B,"Domain name registration method, domain name supervision method, client and domain name supervision terminal ",北京泰尔英福科技有限公司,"金键, 曾西平, 张发振, 胡键伟, 史维君, 李慧玲, 郭健, 单鹏飞, 阚雪娇, 周厚发, 王颜飞",2020-06-30,2020-06-30,2023-08-22,2023-08-22,https://patents.google.com/patent/CN111786795B/en,
CN-115238004-A,Decentralized metasequoiy application supervision method ,常州信息职业技术学院,"陶亚辉, 冯嘉琪, 闵浩阳, 汪诚",2022-07-21,2022-07-21,2022-10-25,,https://patents.google.com/patent/CN115238004A/en,https://patentimages.storage.googleapis.com/64/f6/4a/297dc488efc440/HDA0003757173430000011.png
US-2022309148-A1,Personal Launch Code (PLC) created by an account owner and included within the creation of a device identification code defining the identity of a computing device seeking access to accounts ,"Gary William Streuter, William Pat Price","Gary William Streuter, William Pat Price",2021-03-29,2022-03-27,2022-09-29,,https://patents.google.com/patent/US20220309148A1/en,https://patentimages.storage.googleapis.com/4c/10/89/9a001ac99ca2aa/US20220309148A1-20220929-D00000.png
GB-2605950-A,Secure root-of-trust enrolment and identity management of embedded devices ,Crypto Quantique Ltd,"Woodage Joanne, Paterson Kenneth, Mossayebi Shahram, Anthony Elder John",2021-04-12,2021-04-12,2022-10-26,,https://patents.google.com/patent/GB2605950A/en,
CN-111914231-A,"Block chain-based identity authentication method, system, equipment and storage medium ",中国联合网络通信集团有限公司,路玮,2020-07-23,2020-07-23,2020-11-10,,https://patents.google.com/patent/CN111914231A/en,https://patentimages.storage.googleapis.com/c4/0d/5f/be245924ef39b2/HDA0002598793150000011.png
CN-112861101-A,High-reliability inspection detection data processing method and device ,链晟数科(成都)科技有限公司,"李明华, 尚军杰, 钟武",2021-03-05,2021-03-05,2021-05-28,,https://patents.google.com/patent/CN112861101A/en,https://patentimages.storage.googleapis.com/f9/b0/94/a5ee0025b95354/HDA0002964260940000011.png
US-2021377310-A1,"Method, system, apparatus and program for secure distributed data management using collaborative artificial intelligence ",Shoptaki Inc.,"Asnee Fernando, Kishan Teli, Raveena Mehta, Dhariya Parikh",2020-05-29,2021-05-28,2021-12-02,,https://patents.google.com/patent/US20210377310A1/en,https://patentimages.storage.googleapis.com/a5/bc/6a/4c3e3d22043bb2/US20210377310A1-20211202-D00000.png
CN-112288573-B,"Method, device and equipment for constructing risk assessment model ",支付宝(杭州)信息技术有限公司,"刘思玥, 吴云崇",2020-12-25,2020-12-25,2021-09-21,2021-09-21,https://patents.google.com/patent/CN112288573B/en,https://patentimages.storage.googleapis.com/0b/c8/69/5147444fdc48c1/201216195727.png
CN-112804133-B,Encryption group chat method and system based on blockchain technology ,"江苏通付盾区块链科技有限公司, 江苏通付盾科技有限公司","汪德嘉, 张齐齐, 宋超",2020-12-25,2020-12-25,2023-06-30,2023-06-30,https://patents.google.com/patent/CN112804133B/en,https://patentimages.storage.googleapis.com/b7/78/33/162aa65ad205fe/HDA0002861201370000011.png
CN-115828328-A,"Method, device, processor and storage medium for managing full life cycle of confidential unstructured data based on block chain in trusted environment ",普元信息技术股份有限公司,"魏明, 李卜",2022-12-23,2022-12-23,2023-03-21,,https://patents.google.com/patent/CN115828328A/en,https://patentimages.storage.googleapis.com/7d/5f/1c/650ba8cb4bf75e/HDA0004014281160000011.png
CN-114666682-A,Multi-sensor Internet of things resource self-adaptive deployment management and control middleware ,陈同中,陈同中,2022-03-25,2022-03-25,2022-06-24,,https://patents.google.com/patent/CN114666682A/en,https://patentimages.storage.googleapis.com/54/d1/b5/ed7599e1ab8c60/HDA0003564221190000011.png
CN-114896616-A,Policy processing method and system based on block chain ,中国农业银行股份有限公司,"赵鹏, 朱全鑫",2022-05-26,2022-05-26,2022-08-12,,https://patents.google.com/patent/CN114896616A/en,https://patentimages.storage.googleapis.com/e8/b6/96/fec34802a69e99/HDA0003663802050000011.png
CN-111552215-A,Internet of things equipment safety protection method and system ,中国联合网络通信集团有限公司,黄珂,2020-05-22,2020-05-22,2020-08-18,,https://patents.google.com/patent/CN111552215A/en,https://patentimages.storage.googleapis.com/54/97/d5/b87a253f936c26/HDA0002504559800000011.png
CN-113468569-A,Data encryption method and device and data decryption method and device ,京东科技控股股份有限公司,于潇豫,2021-07-13,2021-07-13,2021-10-01,,https://patents.google.com/patent/CN113468569A/en,https://patentimages.storage.googleapis.com/8d/9d/04/186eccbffc98c3/HDA0003161435750000011.png
CN-111666544-A,Block chain-based personal information right confirming method and block chain client ,广州网格科技有限公司,"张世杰, 刘媛媛, 曾宇龙",2020-05-11,2020-05-11,2020-09-15,,https://patents.google.com/patent/CN111666544A/en,
CN-113781689-A,Access control system based on block chain ,安徽高山科技有限公司,"杨宁波, 朱清",2021-08-25,2021-08-25,2021-12-10,,https://patents.google.com/patent/CN113781689A/en,https://patentimages.storage.googleapis.com/a1/bc/7b/3b7189bf17e874/HDA0003229381920000011.png
CN-114374700-A,Master-slave multi-chain based trusted identity management method supporting wide area collaboration ,"之江实验室, 南京邮电大学","季一木, 陈飞, 吴飞, 万志国, 宋一波, 肖小英, 胥熙, 王木森",2022-01-10,2022-01-10,2022-04-19,,https://patents.google.com/patent/CN114374700A/en,https://patentimages.storage.googleapis.com/f5/8e/27/852e86f2c57f19/220110164339.png
CN-112819483-A,Block chain-based product traceability management method and device and related equipment ,杭州趣链科技有限公司,"匡立中, 蔡亮, 李伟, 张帅, 宋星",2020-12-30,2020-12-30,2021-05-18,,https://patents.google.com/patent/CN112819483A/en,https://patentimages.storage.googleapis.com/d9/96/9a/d76e32f6127b53/HDA0002874088170000011.png
CN-111339116-A,Block chain-based method for sharing open bank data ,中央财经大学,"朱建明, 张沁楠, 高胜",2020-02-29,2020-02-29,2020-06-26,,https://patents.google.com/patent/CN111339116A/en,https://patentimages.storage.googleapis.com/2d/42/dd/921a76834fc602/HDA0002396130520000011.png
CN-114726547-A,Industrial internet access control method based on data exchange middleware and readable medium ,中国信息通信研究院,"谢滨, 田娟, 刘阳, 朱斯语, 程彤彤",2022-05-16,2022-05-16,2022-07-08,,https://patents.google.com/patent/CN114726547A/en,https://patentimages.storage.googleapis.com/77/8b/e6/43860f86073cab/220510154901.png
US-2022210173-A1,Contextual zero trust network access (ztna) based on dynamic security posture insights ,"Fortinet, Inc.","Roy KATMOR, Udi YAVO, Ido Kelson",2020-12-31,2020-12-31,2022-06-30,,https://patents.google.com/patent/US20220210173A1/en,https://patentimages.storage.googleapis.com/e2/cd/a2/21489c365164ed/US20220210173A1-20220630-D00000.png
US-2021256113-A1,Blockchain Validation of Software ,Bank Of America Corporation,"Christopher J. Stott, Caleb G. Mann",2020-02-14,2020-02-14,2021-08-19,,https://patents.google.com/patent/US20210256113A1/en,https://patentimages.storage.googleapis.com/ef/23/1c/98e3a22535feaa/US20210256113A1-20210819-D00000.png
CN-113505401-B,Hybrid PUF circuit capable of extracting physical fingerprints of chip and circuit board and extraction method ,湖北工业大学,"贺章擎, 张宵, 张月皎, 万美琳",2021-07-13,2021-07-13,2022-04-26,2022-04-26,https://patents.google.com/patent/CN113505401B/en,https://patentimages.storage.googleapis.com/2b/60/44/489fd6509fefda/HDA0003160158500000011.png
EP-4133397-A1,Nuts: flexible hierarchy object graphs ,"Nuts Holdings, LLC","Yoon Ho AUH, Nicholas BENNIG, Sotirios TRIANTAFILLOU",2020-04-09,2021-03-26,2023-02-15,,https://patents.google.com/patent/EP4133397A1/en,
CN-115987644-A,Intelligent power distribution internet of things safety authentication system ,"中国电力科学研究院有限公司, 国家电网有限公司, 国网福建省电力有限公司, 国网福建省电力有限公司经济技术研究院, 国网浙江省电力有限公司, 上海华科智谷人工智能研究院, 上海物盾信息科技有限公司","段祥骏, 张琳, 许媛媛, 林奕夫, 陈雪, 朱俊伟, 何锋, 孙歆, 吕磅, 戴桦, 孙昌华, 汪溢镭, 何积丰, 汤晓冬, 唐仁杰, 徐梦宇, 边珊",2022-12-26,2022-12-26,2023-04-18,,https://patents.google.com/patent/CN115987644A/en,https://patentimages.storage.googleapis.com/30/65/ec/b056a4e11f0a5e/HDA0004017262250000011.png
CN-113935840-A,Method and apparatus for establishing associations of virtual and real vehicles in a blockchain network ,智己汽车科技有限公司,"陈燕语, 钱刚",2021-10-29,2021-10-29,2022-01-14,,https://patents.google.com/patent/CN113935840A/en,https://patentimages.storage.googleapis.com/53/b8/de/d312dacd720223/2110291045281.png
CN-112468302-A,Editable blockchain based on verifiable multiparty secret sharing ,"湖南天河国云科技有限公司, 国家计算机网络与信息安全管理中心","刘澧沙, 谭林, 毛洪亮, 苏沐冉, 吴震, 杨征",2020-10-23,2020-11-16,2021-03-09,,https://patents.google.com/patent/CN112468302A/en,https://patentimages.storage.googleapis.com/c3/d9/1e/d362a99532f82a/HDA0002779295490000011.png
WO-2022214690-A1,Method for trading a digital asset ,Eggtronic Engineering SpA,"Andrea BETTATI, Gabriele LODI, Davide MALVEZZI, Alice ROVERSI, Igor Spinella",2021-04-08,2022-04-08,2022-10-13,,https://patents.google.com/patent/WO2022214690A1/en,
CN-112200585-A,"Service processing method, device, equipment and system ",支付宝(杭州)信息技术有限公司,"孙鹏, 杨伟杰, 王一宝, 从德鹏",2020-11-10,2020-11-10,2021-01-08,,https://patents.google.com/patent/CN112200585A/en,https://patentimages.storage.googleapis.com/72/2e/4b/acb4ca23cdda3f/HDA0002770728270000011.png
CN-113014387-B,Method for improving multidimensional encryption interface based on hardware encryption machine and encryption device ,杭州云象网络技术有限公司,"黄步添, 方航, 苑振霞, 刘成永, 王建冲, 罗春凤, 刘振广",2021-04-09,2021-04-09,2022-07-19,2022-07-19,https://patents.google.com/patent/CN113014387B/en,https://patentimages.storage.googleapis.com/86/1d/2e/6a5392bacacaa5/HDA0003013301630000011.png
CN-112561721-A,Live pig information processing method and device and block chain node point equipment ,杭州趣链科技有限公司,"李伟, 蔡亮, 匡立中, 谢杨洁, 李潇",2020-12-11,2020-12-11,2021-03-26,,https://patents.google.com/patent/CN112561721A/en,https://patentimages.storage.googleapis.com/14/a1/b3/65a841833dd6e5/HDA0002832399060000011.png
CN-116032937-A,Edge computing equipment calculation transaction method and system ,中国联合网络通信集团有限公司,"杨开敏, 加雄伟, 孙进芳, 穆晓君",2022-11-28,2022-11-28,2023-04-28,,https://patents.google.com/patent/CN116032937A/en,https://patentimages.storage.googleapis.com/04/68/6e/af5d94c4f46dd0/HDA0003966874730000011.png
CN-112000936-A,"Cross-domain attribute heterogeneous identity service method, medium and equipment ",天翼电子商务有限公司,"徐潜, 贺伟, 严永峰",2020-07-31,2020-07-31,2020-11-27,,https://patents.google.com/patent/CN112000936A/en,https://patentimages.storage.googleapis.com/b3/ee/b0/b8925022ac70c6/HDA0002613454370000011.png
US-2021342472-A1,Framework for maintaining ownership of personal information in a network environment ,"David Forman, Julie Rossallini Coker","David Forman, Julie Rossallini Coker",2020-01-10,2021-01-11,2021-11-04,,https://patents.google.com/patent/US20210342472A1/en,https://patentimages.storage.googleapis.com/3e/e5/19/4b2e6daed4d072/US20210342472A1-20211104-D00000.png
CN-112732832-A,DID and zero knowledge proof based block chain supply chain financial supply method and system ,上海泰砥科技有限公司,梁强,2021-01-06,2021-01-06,2021-04-30,,https://patents.google.com/patent/CN112732832A/en,https://patentimages.storage.googleapis.com/f0/db/d1/00279ba90be3d9/HDA0002885406010000011.png
CN-112003858-A,"Block chain-based platform docking method, electronic device and storage medium ",杭州云链趣链数字科技有限公司,"姜勇, 陈宇峰, 张继强, 王泽伟",2020-08-21,2020-08-21,2020-11-27,,https://patents.google.com/patent/CN112003858A/en,https://patentimages.storage.googleapis.com/62/4d/c0/1bcafcccffc395/HDA0002643310190000011.png
CN-111767095-A,"Micro-service generation method and device, terminal equipment and storage medium ",平安国际智慧城市科技股份有限公司,曾海辉,2020-06-30,2020-06-30,2020-10-13,,https://patents.google.com/patent/CN111767095A/en,https://patentimages.storage.googleapis.com/18/ef/fb/7b74b46e6a8989/HDA0002563495990000011.png
CN-112291062-A,Voting method and device based on block chain ,深圳前海微众银行股份有限公司,"李昊轩, 严强, 廖飞强, 王朝阳, 李辉忠, 张开翔, 范瑞彬",2020-10-28,2020-10-28,2021-01-29,,https://patents.google.com/patent/CN112291062A/en,https://patentimages.storage.googleapis.com/2d/52/c8/4e567d9e08c505/HDA0002748117230000011.png
CN-112926033-A,Task process tracing system based on block chain cross-chain cooperation ,南京星链高科技发展有限公司,"王欣, 王庆阳, 孔翔玉, 吕泽琴",2021-03-18,2021-03-18,2021-06-08,,https://patents.google.com/patent/CN112926033A/en,https://patentimages.storage.googleapis.com/66/3e/a8/2d7a8533cfb1c4/210315100851.png
CN-111832001-A,Identity management method and identity management system based on block chain ,"国家信息中心, 中电科大数据研究院有限公司","魏连�, 郭亓元, 牟其林, 许卡, 刘鹏",2020-07-20,2020-07-20,2020-10-27,,https://patents.google.com/patent/CN111832001A/en,https://patentimages.storage.googleapis.com/d3/b3/43/1e1e568c447d95/HDA0002590993570000011.png
US-11743730-B1,"Access controlling network architectures and systems, having cellular network components and elements modified to host access controlling schemas designed to transform and/or facilitate cellular communication signals in accordance with novel cellular communications protocols with multi-part multi-functional address signaling, and methods for use thereof ",Starkeys Llc,Ari Kahn,2022-05-31,2022-10-14,2023-08-29,2023-08-29,https://patents.google.com/patent/US11743730B1/en,https://patentimages.storage.googleapis.com/d6/f6/a0/7f86691f79fb3b/US11743730-20230829-D00000.png
CN-113468276-A,Trusted data acquisition method and device of on-chain prediction machine and electronic equipment ,北京微芯感知科技有限公司,不公告发明人,2021-09-06,2021-09-06,2021-10-01,,https://patents.google.com/patent/CN113468276A/en,https://patentimages.storage.googleapis.com/b3/ba/73/5205edaf03428f/210902170008.png
CN-113609463-B,Internet of things system based on block chain identity management ,湖南宸瀚信息科技有限责任公司,"曹源, 汪大明, 邓罡, 周忠宝, 曹宇",2021-10-08,2021-10-08,2022-01-04,2022-01-04,https://patents.google.com/patent/CN113609463B/en,https://patentimages.storage.googleapis.com/69/a1/fe/9ecd8e586df6d2/210922160606.png
CN-111476574-A,Novel security IC card and authentication system and method ,青岛信安智融科技有限公司,"陆权, 靳浩春, 王永建, 冷广玲",2020-04-14,2020-04-14,2020-07-31,,https://patents.google.com/patent/CN111476574A/en,https://patentimages.storage.googleapis.com/56/31/d5/6765c78f07b033/HDA0002450039160000011.png
CN-112767091-A,"Method, device and medium for processing supervisable bid and privacy based on block chain ",湖南大学,"马超群, 匡先华, 米先华, 周中定, 李信儒, 兰秋军, 万丽",2021-01-29,2021-01-29,2021-05-07,,https://patents.google.com/patent/CN112767091A/en,https://patentimages.storage.googleapis.com/83/10/5a/a4bd5dfb66f69d/HDA0002923989290000011.png
CN-112507352-B,Data sharing method and system based on block chain ,中国联合网络通信集团有限公司,黄珂,2020-11-30,2020-11-30,2023-01-17,2023-01-17,https://patents.google.com/patent/CN112507352B/en,https://patentimages.storage.googleapis.com/3b/76/e9/f7ee641a20bd58/HDA0002806346380000011.png
